{
  "id": "drone1",
  "time": "2025-10-29T12:10:05Z",
  "position": {
    "lat": 39.9265,
    "lon": 32.8423,
    "alt_m": 312.0
  },
  "yaw_deg": 266.2,
  "pitch_deg": 0.8,
  "roll_deg": -0.4,
  "ground_speed_mps": 13.4,
  "vertical_speed_mps": 0.1,
  "mode": "AUTO",
  "battery": {
    "soc_pct": 74.2,
    "voltage_v": 15.3
  },
  "link": {
    "rssi_dbm": -57,
    "latency_ms": 41
  }
}
